name,description,url,source,category,stem_fields,target_grade,cost,location_type,time_commitment,prerequisite_level,support_level,deadline,financial_barrier_level,financial_aid_available,family_income_consideration,hidden_costs_level,cost_category,diversity_focus,underrepresented_friendly,first_gen_support,cultural_competency,rural_accessible,transportation_required,internet_dependency,regional_availability,family_involvement_required,peer_network_building,mentor_access_level
PLTW Launch - Modeling and Analysis,Students learn to model real-world phenomena and analyze relationships between variables using mathematical thinking and engineering design process to solve problems.,https://www.pltw.org/our-programs/pltw-launch/launch-modules/modeling-and-analysis,Project Lead The Way,Elementary Program,"Engineering, Mathematics",K-5,School-dependent,School-based,Module-based (10-15 hours),None,High,School enrollment,Low,False,Any,None,School-dependent,True,True,True,High,True,False,Basic,National,None,True,Adult
PLTW Launch - Structure and Function,"Students explore how the shape and structure of an object affects its function through building, testing, and refining design solutions for engineering challenges.",https://www.pltw.org/our-programs/pltw-launch/launch-modules/structure-and-function,Project Lead The Way,Elementary Program,"Engineering, Physics",K-5,School-dependent,School-based,Module-based (10-15 hours),None,High,School enrollment,Low,False,Any,None,School-dependent,True,True,True,High,True,False,Basic,National,None,True,Adult
PLTW Launch - Automation and Robotics,Students explore how machines help humans by programming robots to solve problems and complete tasks using computational thinking and engineering design.,https://www.pltw.org/our-programs/pltw-launch/launch-modules/automation-and-robotics,Project Lead The Way,Elementary Program,"Engineering, Computer Science, Robotics",K-5,School-dependent,School-based,Module-based (10-15 hours),None,High,School enrollment,Low,False,Any,None,School-dependent,True,True,True,High,True,False,Basic,National,None,True,Adult
PLTW Gateway - Design and Modeling,Students discover the design process and develop understanding of design principles using industry-standard 3D modeling software to create virtual designs.,https://www.pltw.org/our-programs/pltw-gateway/gateway-courses/design-and-modeling,Project Lead The Way,Middle School Program,"Engineering, Technology, Design",6-8,School-dependent,School-based,Semester course,Basic,High,School enrollment,Medium,False,Any,None,School-dependent,True,True,True,High,True,False,Basic,National,None,True,Adult
PLTW Gateway - Automation and Robotics,"Students explore mechanical systems, energy transfer, machine automation, and computer control systems while programming VEX Robotics equipment.",https://www.pltw.org/our-programs/pltw-gateway/gateway-courses/automation-and-robotics,Project Lead The Way,Middle School Program,"Engineering, Robotics, Computer Science",6-8,School-dependent,School-based,Semester course,Basic,High,School enrollment,Medium,False,Any,None,School-dependent,True,True,True,High,True,False,Basic,National,None,True,Adult
PLTW Gateway - Medical Detectives,"Students solve medical mysteries through hands-on projects and labs, learning about human body systems, genetics, and biomedical technologies.",https://www.pltw.org/our-programs/pltw-gateway/gateway-courses/medical-detectives,Project Lead The Way,Middle School Program,"Biomedical Science, Biology, Health Science",6-8,School-dependent,School-based,Semester course,Basic,High,School enrollment,Medium,False,Any,None,School-dependent,True,True,True,High,True,False,Basic,National,None,True,Adult
PLTW Gateway - Computer Science for Innovators and Makers,Students explore computer science concepts through programming while creating solutions to authentic problems using physical computing devices and sensors.,https://www.pltw.org/our-programs/pltw-gateway/gateway-courses/computer-science-innovators-and-makers,Project Lead The Way,Middle School Program,"Computer Science, Programming, Engineering",6-8,School-dependent,School-based,Semester course,Basic,High,School enrollment,Medium,False,Any,None,School-dependent,True,True,True,High,True,False,Basic,National,None,True,Adult
PLTW Engineering - Introduction to Engineering Design,"Students dig deep into the engineering design process while applying mathematical analysis, scientific principles, and engineering standards to solve engineering problems.",https://www.pltw.org/our-programs/pltw-engineering/pltw-engineering-courses/introduction-engineering-design,Project Lead The Way,Engineering Program,"Engineering, Design, Mathematics",9-12,School-dependent,School-based,Full year course,Medium,High,School enrollment,Medium,False,Any,None,School-dependent,True,True,True,High,True,False,Basic,National,None,True,Adult
PLTW Engineering - Principles of Engineering,"Students explore engineering career paths while learning about mechanisms, strength of materials, and applied physics through hands-on projects and design challenges.",https://www.pltw.org/our-programs/pltw-engineering/pltw-engineering-courses/principles-engineering,Project Lead The Way,Engineering Program,"Engineering, Physics, Materials Science",9-12,School-dependent,School-based,Full year course,Medium,High,School enrollment,Medium,False,Any,None,School-dependent,True,True,True,High,True,False,Basic,National,None,True,Adult
PLTW Engineering - Digital Electronics,"Students explore electronic circuits, digital logic, and programmable logic devices while learning to design and build electronic systems and devices.",https://www.pltw.org/our-programs/pltw-engineering/pltw-engineering-courses/digital-electronics,Project Lead The Way,Engineering Program,"Engineering, Electronics, Computer Science",9-12,School-dependent,School-based,Full year course,Medium,High,School enrollment,Medium,False,Any,None,School-dependent,True,True,True,High,True,False,Basic,National,None,True,Adult
PLTW Engineering - Aerospace Engineering,"Students explore the physics of flight and space travel while designing and testing model aircraft, rockets, and space systems using engineering principles.",https://www.pltw.org/our-programs/pltw-engineering/pltw-engineering-courses/aerospace-engineering,Project Lead The Way,Engineering Program,"Aerospace Engineering, Physics, Mathematics",9-12,School-dependent,School-based,Full year course,Medium,High,School enrollment,Medium,False,Any,None,School-dependent,True,True,True,High,True,False,Basic,National,None,True,Adult
PLTW Engineering - Engineering Design and Development,"Capstone course where students work in teams to research, design, and construct solutions to open-ended engineering problems using the full design process.",https://www.pltw.org/our-programs/pltw-engineering/pltw-engineering-courses/engineering-design-and-development,Project Lead The Way,Engineering Program,"Engineering, Project Management, Design",11-12,School-dependent,School-based,Full year capstone,High,High,School enrollment,Medium,False,Any,None,School-dependent,True,True,True,High,True,False,Basic,National,None,True,Adult
PLTW Biomedical Science - Principles of Biomedical Sciences,"Students investigate biomedical science careers while exploring concepts of human medicine, public health, and medical research through hands-on projects and case studies.",https://www.pltw.org/our-programs/pltw-biomedical-science/pltw-biomedical-science-courses/principles-biomedical-sciences,Project Lead The Way,Biomedical Program,"Biomedical Science, Biology, Health Science",9-12,School-dependent,School-based,Full year course,Medium,High,School enrollment,Medium,False,Any,None,School-dependent,True,True,True,High,True,False,Basic,National,None,True,Adult
PLTW Biomedical Science - Human Body Systems,"Students examine interactions of human body systems and explore identity, communication, and homeostasis through projects involving bioinformatics and engineering design.",https://www.pltw.org/our-programs/pltw-biomedical-science/pltw-biomedical-science-courses/human-body-systems,Project Lead The Way,Biomedical Program,"Biomedical Science, Anatomy, Physiology",9-12,School-dependent,School-based,Full year course,Medium,High,School enrollment,Medium,False,Any,None,School-dependent,True,True,True,High,True,False,Basic,National,None,True,Adult
PLTW Biomedical Science - Medical Interventions,"Students investigate medical interventions and follow patient cases to learn about diagnosis, treatment, and prevention of disease using current medical technologies.",https://www.pltw.org/our-programs/pltw-biomedical-science/pltw-biomedical-science-courses/medical-interventions,Project Lead The Way,Biomedical Program,"Biomedical Science, Medicine, Pharmacology",9-12,School-dependent,School-based,Full year course,Medium,High,School enrollment,Medium,False,Any,None,School-dependent,True,True,True,High,True,False,Basic,National,None,True,Adult
PLTW Biomedical Science - Biomedical Innovation,"Capstone course where students design innovative solutions to real biomedical challenges, working with medical professionals and learning about the product development cycle.",https://www.pltw.org/our-programs/pltw-biomedical-science/pltw-biomedical-science-courses/biomedical-innovation,Project Lead The Way,Biomedical Program,"Biomedical Science, Innovation, Research",11-12,School-dependent,School-based,Full year capstone,High,High,School enrollment,Medium,False,Any,None,School-dependent,True,True,True,High,True,False,Basic,National,None,True,Adult
PLTW Computer Science - Computer Science Essentials,"Students explore computing concepts including algorithms, programming, data analysis, and the societal impact of computing through hands-on activities.",https://www.pltw.org/our-programs/pltw-computer-science/pltw-computer-science-courses/computer-science-essentials,Project Lead The Way,Computer Science Program,"Computer Science, Programming, Data Science",9-12,School-dependent,School-based,Full year course,Medium,High,School enrollment,Medium,False,Any,None,School-dependent,True,True,True,High,True,False,Basic,National,None,True,Adult
PLTW Computer Science - Computer Science Principles,"Students develop computational thinking skills while exploring programming, algorithms, data representation, and the impact of computing innovations on society.",https://www.pltw.org/our-programs/pltw-computer-science/pltw-computer-science-courses/computer-science-principles,Project Lead The Way,Computer Science Program,"Computer Science, Programming, Algorithms",9-12,School-dependent,School-based,Full year course,Medium,High,School enrollment,Medium,False,Any,None,School-dependent,True,True,True,High,True,False,Basic,National,None,True,Adult
PLTW Computer Science - Computer Science A,"Students learn object-oriented programming using Java while developing problem-solving skills and understanding data structures, algorithms, and software design.",https://www.pltw.org/our-programs/pltw-computer-science/pltw-computer-science-courses/computer-science-a,Project Lead The Way,Computer Science Program,"Computer Science, Programming, Software Development",10-12,School-dependent,School-based,Full year course,High,High,School enrollment,Medium,False,Any,None,School-dependent,True,True,True,High,True,False,Basic,National,None,True,Adult
PLTW Computer Science - Cybersecurity,"Students explore cybersecurity concepts including network security, cryptography, and ethical hacking while learning to protect digital information and systems.",https://www.pltw.org/our-programs/pltw-computer-science/pltw-computer-science-courses/cybersecurity,Project Lead The Way,Computer Science Program,"Computer Science, Cybersecurity, Information Technology",10-12,School-dependent,School-based,Full year course,High,High,School enrollment,Medium,False,Any,None,School-dependent,True,True,True,High,True,False,Basic,National,None,True,Adult
