name,description,url,source,category,stem_fields,target_grade,cost,location_type,time_commitment,prerequisite_level,support_level,deadline,financial_barrier_level,financial_aid_available,family_income_consideration,hidden_costs_level,cost_category,diversity_focus,underrepresented_friendly,first_gen_support,cultural_competency,rural_accessible,transportation_required,internet_dependency,regional_availability,family_involvement_required,peer_network_building,mentor_access_level
Congressional App Challenge,Nationwide coding competition for high school students organized by US House of Representatives. Students create and submit original apps addressing issues in their communities. Compete within congressional district - one winner per district. Individual or team submissions (up to 4 students). Any coding language or platform accepted. Winners invited to Capitol Hill showcase in Washington DC. Apps displayed in US Capitol. National recognition from Member of Congress.,https://www.congressionalappchallenge.us/,Congressional App Challenge,Coding Competition,"Computer Science, App Development, Mobile Development, Web Development",9-12,Free,Online,3-6 months,Medium,Medium,Annual-November,None,False,False,None,Free,True,True,True,High,True,False,High-speed-required,National,None,True,Optional
Congressional App Challenge District Competition,"District-level app development competition. Each congressional district has separate competition with one winner. Create mobile app, web app, or software addressing local or national issue. Must be original work completed during competition period. Submit code, demo video, and documentation. Local judging by tech professionals. Recognition from your Representative in Congress. Great for college applications and STEM portfolios.",https://www.congressionalappchallenge.us/students/,Congressional App Challenge,Coding Competition,"Computer Science, Software Engineering",9-12,Free,Online,3-6 months,Medium,Medium,Annual-November,None,False,False,None,Free,True,True,True,High,True,False,High-speed-required,National,None,True,Optional
Congressional App Challenge #HouseOfCode Event,Annual showcase event in Washington DC for winning students. Display apps in US Capitol building. Meet Members of Congress and tech industry leaders. Recognition ceremony on Capitol Hill. Networking with other winning student developers nationwide. Tour of Washington DC and government buildings. All expenses paid for winners. Career connections in technology and public service.,https://www.congressionalappchallenge.us/,Congressional App Challenge,National Showcase Event,"Computer Science, Public Policy",10-12,Free,National,2-3 days,High,Medium,Invitation-only,None,False,False,None,Free,True,True,True,High,True,True,High-speed-required,National,None,True,Optional
Congressional App Challenge Webinar Series,"Free webinars for students learning app development. Topics include coding fundamentals, UI/UX design, app deployment, and pitching ideas. Led by tech professionals and past winners. Q&A sessions with industry experts. Recorded sessions available for replay. Tips for competition success. Learn various programming languages and frameworks. Open to all interested students.",https://www.congressionalappchallenge.us/students/,Congressional App Challenge,Educational Webinar,"Computer Science, App Development",9-12,Free,Online,1 hour per webinar,Basic,Medium,Seasonal,None,False,False,None,Free,True,True,True,High,True,False,High-speed-required,National,None,True,Optional
Congressional App Challenge Resources Hub,"Comprehensive online resources for student app developers. Coding tutorials, design guides, and submission templates. Past winning apps for inspiration. Judging criteria and evaluation rubrics. Timeline and deadline information by district. FAQs and technical support. Free development tools and platforms list. Mentorship connection opportunities.",https://www.congressionalappchallenge.us/students/,Congressional App Challenge,Educational Resources,"Computer Science, Software Development",9-12,Free,Online,Self-paced,None,Medium,Rolling,None,False,False,None,Free,True,True,True,High,True,False,High-speed-required,National,None,True,Optional
Congressional App Challenge Team Competition,"Team-based app development option for Congressional App Challenge. Teams of 2-4 high school students collaborate on app. Emphasizes teamwork, project management, and diverse skills. Combine programmers, designers, and subject matter experts. Same submission requirements as individual entries. Great for learning collaborative development. Schools can support multiple teams in same district.",https://www.congressionalappchallenge.us/,Congressional App Challenge,Team Competition,"Computer Science, Team Collaboration",9-12,Free,Online,3-6 months,Medium,Medium,Annual-November,None,False,False,None,Free,True,True,True,High,True,False,High-speed-required,National,None,True,Optional
Congressional App Challenge Educator Support,Resources for teachers and advisors supporting student participants. Classroom integration guides and lesson plans. How to organize school app challenge programs. Mentorship resources and industry connections. Help students find coding mentors and resources. Information sessions for educators. Certificate of participation for advisors. Build coding programs at your school.,https://www.congressionalappchallenge.us/,Congressional App Challenge,Educator Resources,Computer Science Education,9-12,Free,Online,Flexible,None,Medium,Rolling,None,False,False,None,Free,True,True,True,High,True,False,High-speed-required,National,None,True,Optional
Congressional App Challenge Alumni Network,Network of past Congressional App Challenge participants and winners. Mentorship for current participants from alumni. Career connections in tech industry and government. Share experiences and advice. Annual alumni reunions at tech events. Some alumni at top tech companies and startups. Continued recognition from Members of Congress. Community of young technologists.,https://www.congressionalappchallenge.us/,Congressional App Challenge,Alumni Network,"Computer Science, Career Development",11-12,Free,Online,Ongoing,Medium,Medium,Rolling,None,False,False,None,Free,True,True,True,High,True,False,High-speed-required,National,None,True,Professional
