name,description,url,source,category,stem_fields,target_grade,cost,location_type,time_commitment,prerequisite_level,support_level,deadline,financial_barrier_level,financial_aid_available,family_income_consideration,hidden_costs_level,cost_category,diversity_focus,underrepresented_friendly,first_gen_support,cultural_competency,rural_accessible,transportation_required,internet_dependency,regional_availability,family_involvement_required,peer_network_building,mentor_access_level
Google Code Jam,"Google's longest running global coding competition featuring algorithmic puzzles across multiple rounds. Participants solve challenging problems using any programming language, competing to advance through Online Qualification, Online Rounds, and the World Finals.",https://codingcompetitions.withgoogle.com/codejam,Google Coding Competitions,Coding Competition,"Computer Science, Algorithms, Problem Solving",College,Free,Online,Multiple rounds over several months (2-3 hours per round),High,Low,Annual (typically March-April registration),None,N/A,None,None,Free,"Open to all, Google diversity initiatives",True,Limited,High,True,False,High-speed-required,International,None,True,None
Google Kick Start,"Online coding competition with multiple rounds throughout the year, designed to help participants develop and hone their programming skills. Features algorithmic challenges suitable for students and professionals looking to improve problem-solving abilities.",https://codingcompetitions.withgoogle.com/kickstart,Google Coding Competitions,Coding Competition,"Computer Science, Algorithms, Problem Solving","9-12, College",Free,Online,"3 hours per round, 8+ rounds per year",High,Low,Year-round (multiple rounds),None,N/A,None,None,Free,"Open to all, Google diversity initiatives",True,Limited,High,True,False,High-speed-required,International,None,True,None
Google Hash Code (Practice),Archive of past Hash Code team programming competition problems. Teams of 2-4 members work together to solve an optimization problem using any programming language. Past problems remain available for practice and skill development.,https://codingcompetitions.withgoogle.com/hashcode,Google Coding Competitions,Coding Competition,"Computer Science, Algorithms, Optimization","9-12, College",Free,Online,4 hours per problem set (self-paced practice),High,Low,Self-paced (archived competition),None,N/A,None,None,Free,"Open to all, Google diversity initiatives",True,Limited,High,True,False,High-speed-required,International,None,True,None
Code Jam to I/O for Women,"Google coding competition specifically designed for women developers, offering a chance to win a trip to Google I/O. Features algorithmic challenges and promotes diversity in tech. Open to women worldwide with varying levels of competitive programming experience.",https://codingcompetitions.withgoogle.com/,Google Coding Competitions,Coding Competition,"Computer Science, Algorithms, Problem Solving",College,Free,Online,2-3 rounds over 2-3 months,High,Low,Annual (typically February-March),None,N/A,None,None,Free,Women in tech,True,Limited,High,True,False,High-speed-required,International,None,True,None
Google Coding Competitions Practice Archive,"Comprehensive archive of past competition problems from Code Jam, Kick Start, and other Google competitions. Free access to thousands of algorithmic problems with test cases and solutions. Excellent resource for interview preparation and skill development.",https://codingcompetitions.withgoogle.com/,Google Coding Competitions,Coding Competition,"Computer Science, Algorithms, Problem Solving","9-12, College",Free,Online,Self-paced (continuous access),Medium,Low,Self-paced (no deadline),None,N/A,None,None,Free,"Open to all, Google diversity initiatives",True,Limited,High,True,False,High-speed-required,International,None,True,None
Google Code-in (Educational Archive),"Archive of Google's student competition for pre-university students (ages 13-17) focused on open source software development. While no longer active, the educational materials and project ideas remain valuable for learning open source contribution, coding, documentation, and design.",https://codein.withgoogle.com/archive/,Google Coding Competitions,Coding Competition,"Computer Science, Software Development, Open Source",9-12,Free,Online,Self-paced (archived materials),Medium,Low,Self-paced (archived program),None,N/A,None,None,Free,Youth engagement in tech,True,Limited,High,True,False,High-speed-required,International,Parental consent required (under 18),True,Medium
