name,description,url,source,category,stem_fields,target_grade,cost,location_type,time_commitment,prerequisite_level,support_level,deadline,financial_barrier_level,financial_aid_available,family_income_consideration,hidden_costs_level,cost_category,diversity_focus,underrepresented_friendly,first_gen_support,cultural_competency,rural_accessible,transportation_required,internet_dependency,regional_availability,family_involvement_required,peer_network_building,mentor_access_level
Garcia Research Scholars Program - Summer Research,"Intensive 7-week summer research program at Stony Brook University for high school students. Work one-on-one with faculty mentors conducting authentic scientific research in biology, chemistry, physics, mathematics, computer science, or engineering. Full-time commitment developing research question, conducting experiments, analyzing data, and preparing presentations. Students receive stipend. Gain hands-on laboratory experience and develop scientific thinking. Selective admission based on academic achievement and research interest.",https://www.stonybrook.edu/commcms/garcia/,Garcia Research Scholars,Research,"Biology, Chemistry, Physics, Mathematics, Computer Science, Engineering",9-12,Free,In-person,7 weeks summer + academic year,High,High,January,Low,Stipend-provided,Not required,Travel,Paid-Program,True,True,True,High,False,True,Basic,Regional,Medium,True,Professional
Garcia Research Scholars - Academic Year Extension,"Continuation of summer research during academic year for Garcia Scholars. Students continue working with faculty mentors part-time while attending high school. Develop research further, prepare for competitions, and work toward publications. Monthly seminars and research group meetings. Flexible scheduling around school commitments. Strengthen college applications with sustained research experience.",https://www.stonybrook.edu/commcms/garcia/,Garcia Research Scholars,Research,"Biology, Chemistry, Physics, Mathematics, Computer Science, Engineering",9-12,Free,In-person,Part-time academic year,Summer program completion,High,Automatic for summer participants,Low,Stipend-provided,Not required,Travel,Paid-Program,True,True,True,High,False,True,Basic,Regional,Medium,True,Professional
Garcia Research Scholars - Biology and Life Sciences Track,"Research opportunities in molecular biology, genetics, neuroscience, ecology, or biomedical sciences. Work in university laboratories using advanced equipment and techniques. Learn experimental design, microscopy, data analysis, and scientific communication. Projects may include studying gene expression, animal behavior, cellular processes, or disease mechanisms. Mentored by biology faculty.",https://www.stonybrook.edu/commcms/garcia/,Garcia Research Scholars,Research,"Biology, Molecular Biology, Genetics, Neuroscience, Ecology",9-12,Free,In-person,7 weeks summer + academic year,High,High,January,Low,Stipend-provided,Not required,Travel,Paid-Program,True,True,True,High,False,True,Basic,Regional,Medium,True,Professional
Garcia Research Scholars - Chemistry and Materials Science Track,"Research in organic chemistry, inorganic chemistry, physical chemistry, or materials science. Conduct synthesis experiments, analyze compounds, and characterize materials. Use spectroscopy, chromatography, and computational chemistry tools. Projects may explore catalysis, drug design, nanomaterials, or environmental chemistry.",https://www.stonybrook.edu/commcms/garcia/,Garcia Research Scholars,Research,"Chemistry, Materials Science, Chemical Engineering, Nanotechnology",9-12,Free,In-person,7 weeks summer + academic year,High,High,January,Low,Stipend-provided,Not required,Travel,Paid-Program,True,True,True,High,False,True,Basic,Regional,Medium,True,Professional
Garcia Research Scholars - Physics and Astronomy Track,"Research in theoretical or experimental physics, astronomy, or astrophysics. Study particle physics, condensed matter, optics, or cosmology. Use computational modeling, laboratory experiments, or telescope observations. Projects may investigate fundamental physics questions or applied physics applications.",https://www.stonybrook.edu/commcms/garcia/,Garcia Research Scholars,Research,"Physics, Astronomy, Astrophysics, Theoretical Physics",9-12,Free,In-person,7 weeks summer + academic year,High,High,January,Low,Stipend-provided,Not required,Travel,Paid-Program,True,True,True,High,False,True,Basic,Regional,Medium,True,Professional
Garcia Research Scholars - Computer Science and Mathematics Track,"Research in algorithms, artificial intelligence, data science, cybersecurity, pure mathematics, or applied mathematics. Develop software, analyze data, or prove theorems. Projects may involve machine learning, computational biology, cryptography, or mathematical modeling.",https://www.stonybrook.edu/commcms/garcia/,Garcia Research Scholars,Research,"Computer Science, Mathematics, Data Science, Artificial Intelligence",9-12,Free,In-person,7 weeks summer + academic year,High,High,January,Low,Stipend-provided,Not required,Travel,Paid-Program,True,True,True,High,False,True,Basic,Regional,Medium,True,Professional
Garcia Research Scholars - Engineering Track,"Research in mechanical, electrical, biomedical, or environmental engineering. Design experiments, build prototypes, and test engineering solutions. Use CAD software, fabrication equipment, and testing facilities. Projects address real-world engineering challenges.",https://www.stonybrook.edu/commcms/garcia/,Garcia Research Scholars,Research,"Engineering, Mechanical Engineering, Electrical Engineering, Biomedical Engineering",9-12,Free,In-person,7 weeks summer + academic year,High,High,January,Low,Stipend-provided,Not required,Travel,Paid-Program,True,True,True,High,False,True,Basic,Regional,Medium,True,Professional
Garcia Research Scholars - Research Symposium and Competitions,"End-of-summer research symposium where Garcia Scholars present findings to faculty, peers, and families. Develop scientific posters and oral presentations. Support for entering research competitions including Intel ISEF, Regeneron STS, and regional science fairs. Guidance on abstracts, presentations, and competition applications.",https://www.stonybrook.edu/commcms/garcia/,Garcia Research Scholars,Research,"Scientific Communication, Research Presentation, Competition Preparation",9-12,Free,In-person,Program duration,Program participant,High,Summer culmination,None,Not applicable,Not required,None,Free,True,True,True,High,False,True,Basic,Regional,Medium,True,Professional
Garcia Research Scholars - College Application Support,"Guidance leveraging Garcia research experience for college applications. Help framing research in personal statements, supplemental essays, and activity lists. Recommendation letters from faculty mentors. Support applying to selective universities and STEM programs. Resume building and interview preparation.",https://www.stonybrook.edu/commcms/garcia/,Garcia Research Scholars,Research,"College Preparation, Career Guidance, Academic Advising",11-12,Free,In-person,Academic year,Program participant,High,Rolling,None,Not applicable,Not required,None,Free,True,True,True,High,False,False,Required,Regional,Low,True,Professional
