name,description,url,source,category,stem_fields,target_grade,cost,location_type,time_commitment,prerequisite_level,support_level,deadline,financial_barrier_level,financial_aid_available,family_income_consideration,hidden_costs_level,cost_category,diversity_focus,underrepresented_friendly,first_gen_support,cultural_competency,rural_accessible,transportation_required,internet_dependency,regional_availability,family_involvement_required,peer_network_building,mentor_access_level
Pioneer Academics - Summer Session Online Research Program,"Intensive 5-week online research program for academically motivated high school students. Work one-on-one with university professors from top institutions worldwide. Conduct original research culminating in scholarly paper. Choose from 30+ research subjects across STEM, social sciences, and humanities. Weekly live seminars with professor mentor. Develop critical thinking, research methodology, and academic writing skills. Flexible scheduling accommodating students globally. Research paper can be submitted to academic journals and competitions. Highly selective admissions based on academics and intellectual curiosity.",https://pioneeracademics.com/programs/,Pioneer Academics,Research,"Research, Academic Writing, Critical Thinking, Interdisciplinary Studies",9-12,Paid,Online,5 weeks,High,High,Rolling admissions,High,Scholarships-available,Optional,Program-Fee,$1000+,True,True,True,High,True,False,Required,International,None,False,Professional
Pioneer Academics - Artificial Intelligence and Machine Learning,"Research track exploring artificial intelligence, machine learning algorithms, and neural networks. Work with professor specializing in AI to develop original research project. Topics may include computer vision, natural language processing, reinforcement learning, or AI ethics. Implement machine learning models and analyze results. Learn Python programming and AI frameworks. Research applications of AI to real-world problems. Produce scholarly paper suitable for publication or competition submission.",https://pioneeracademics.com/subjects/,Pioneer Academics,Research,"Artificial Intelligence, Machine Learning, Computer Science, Neural Networks, Data Science",9-12,Paid,Online,5 weeks,High,High,Rolling admissions,High,Scholarships-available,Optional,Program-Fee,$1000+,True,True,True,High,True,False,Required,International,None,False,Professional
Pioneer Academics - Biotechnology and Genetic Engineering,"Research in cutting-edge biotechnology including CRISPR, gene therapy, and synthetic biology. Mentored by professor with expertise in molecular biology and genetics. Design theoretical or computational research project exploring genetic engineering applications. Study bioethics and societal implications of biotechnology. Research topics may include disease treatment, agricultural applications, or biomanufacturing. Analyze genomic data and biological systems. Write comprehensive research paper on original findings.",https://pioneeracademics.com/subjects/,Pioneer Academics,Research,"Biotechnology, Genetics, CRISPR, Molecular Biology, Bioengineering",9-12,Paid,Online,5 weeks,High,High,Rolling admissions,High,Scholarships-available,Optional,Program-Fee,$1000+,True,True,True,High,True,False,Required,International,None,False,Professional
Pioneer Academics - Neuroscience and Cognitive Science,"Research exploring brain function, cognition, and behavior. Work with neuroscience professor on topics like neural circuits, memory, consciousness, or neurological disorders. Study intersection of biology, psychology, and computational neuroscience. Research methods may include literature review, data analysis, or computational modeling. Investigate questions about learning, decision-making, or brain plasticity. Develop deep understanding of neuroscience research methods and current frontiers.",https://pioneeracademics.com/subjects/,Pioneer Academics,Research,"Neuroscience, Cognitive Science, Psychology, Biology, Brain Research",9-12,Paid,Online,5 weeks,High,High,Rolling admissions,High,Scholarships-available,Optional,Program-Fee,$1000+,True,True,True,High,True,False,Required,International,None,False,Professional
Pioneer Academics - Astrophysics and Cosmology,"Research in astrophysics, cosmology, and space science. Work with astronomy professor on topics like exoplanets, black holes, dark matter, or the early universe. Analyze astronomical data, study theoretical physics, or explore observational techniques. Research questions about stellar evolution, galaxy formation, or fundamental physics. Learn computational methods for astrophysics. Produce research paper contributing to understanding of the cosmos.",https://pioneeracademics.com/subjects/,Pioneer Academics,Research,"Astrophysics, Astronomy, Cosmology, Physics, Space Science",9-12,Paid,Online,5 weeks,High,High,Rolling admissions,High,Scholarships-available,Optional,Program-Fee,$1000+,True,True,True,High,True,False,Required,International,None,False,Professional
Pioneer Academics - Environmental Science and Climate Change,"Research addressing environmental challenges and climate science. Work with environmental science professor on sustainability, climate modeling, conservation, or renewable energy. Analyze environmental data, study ecosystem dynamics, or explore policy solutions. Research topics may include carbon sequestration, biodiversity loss, ocean acidification, or green technology. Interdisciplinary approach combining science, policy, and ethics. Develop solutions-oriented research contributing to environmental understanding.",https://pioneeracademics.com/subjects/,Pioneer Academics,Research,"Environmental Science, Climate Science, Ecology, Sustainability, Conservation",9-12,Paid,Online,5 weeks,High,High,Rolling admissions,High,Scholarships-available,Optional,Program-Fee,$1000+,True,True,True,High,True,False,Required,International,None,False,Professional
Pioneer Academics - Computer Science and Algorithms,"Research in theoretical or applied computer science. Work with CS professor on algorithms, complexity theory, cryptography, or software engineering. Design and analyze algorithms, explore computational theory, or develop applications. Research may involve coding implementations, mathematical proofs, or system design. Topics can include graph theory, optimization, parallel computing, or computational biology. Build strong foundation in computer science research methodology.",https://pioneeracademics.com/subjects/,Pioneer Academics,Research,"Computer Science, Algorithms, Programming, Software Engineering, Theoretical CS",9-12,Paid,Online,5 weeks,High,High,Rolling admissions,High,Scholarships-available,Optional,Program-Fee,$1000+,True,True,True,High,True,False,Required,International,None,False,Professional
Pioneer Academics - Mathematics and Number Theory,"Research in pure or applied mathematics. Work with mathematics professor on topics like number theory, combinatorics, topology, or mathematical modeling. Explore theoretical questions or applications of mathematics to other fields. Research may involve proving theorems, analyzing mathematical structures, or developing models. Study connections between different areas of mathematics. Develop mathematical reasoning and proof-writing skills. Produce rigorous mathematical research paper.",https://pioneeracademics.com/subjects/,Pioneer Academics,Research,"Mathematics, Number Theory, Pure Math, Applied Math, Mathematical Modeling",9-12,Paid,Online,5 weeks,High,High,Rolling admissions,High,Scholarships-available,Optional,Program-Fee,$1000+,True,True,True,High,True,False,Required,International,None,False,Professional
Pioneer Academics - Biochemistry and Molecular Biology,"Research in biochemistry exploring protein structure, enzyme function, or metabolic pathways. Work with biochemistry professor on topics like drug discovery, structural biology, or cellular processes. Study molecular mechanisms of life at atomic and molecular scales. Research may involve computational analysis, literature review, or theoretical modeling. Topics can include protein folding, signal transduction, or gene regulation. Develop understanding of modern biochemistry research.",https://pioneeracademics.com/subjects/,Pioneer Academics,Research,"Biochemistry, Molecular Biology, Protein Science, Cell Biology, Enzymology",9-12,Paid,Online,5 weeks,High,High,Rolling admissions,High,Scholarships-available,Optional,Program-Fee,$1000+,True,True,True,High,True,False,Required,International,None,False,Professional
Pioneer Academics - Physics and Quantum Mechanics,"Research in theoretical or experimental physics. Work with physics professor on topics like quantum mechanics, particle physics, condensed matter, or thermodynamics. Explore fundamental questions about nature of reality and physical laws. Research may involve mathematical analysis, computational simulations, or thought experiments. Topics can include quantum computing, relativity, superconductivity, or statistical mechanics. Develop deep understanding of physics principles and research methods.",https://pioneeracademics.com/subjects/,Pioneer Academics,Research,"Physics, Quantum Mechanics, Theoretical Physics, Particle Physics, Condensed Matter",9-12,Paid,Online,5 weeks,High,High,Rolling admissions,High,Scholarships-available,Optional,Program-Fee,$1000+,True,True,True,High,True,False,Required,International,None,False,Professional
Pioneer Academics - Chemistry and Materials Science,"Research in organic, inorganic, physical chemistry, or materials science. Work with chemistry professor on topics like chemical synthesis, reaction mechanisms, or novel materials. Study catalysis, nanomaterials, polymers, or drug design. Research may involve computational chemistry, literature analysis, or theoretical modeling. Topics can include sustainable chemistry, battery technology, or medicinal chemistry. Develop understanding of chemical principles and research methodology.",https://pioneeracademics.com/subjects/,Pioneer Academics,Research,"Chemistry, Materials Science, Chemical Engineering, Nanotechnology, Organic Chemistry",9-12,Paid,Online,5 weeks,High,High,Rolling admissions,High,Scholarships-available,Optional,Program-Fee,$1000+,True,True,True,High,True,False,Required,International,None,False,Professional
Pioneer Academics - Engineering and Robotics,"Research in mechanical, electrical, or computer engineering. Work with engineering professor on topics like robotics, control systems, or engineering design. Study automation, sensor systems, or mechatronics. Research may involve design projects, simulations, or optimization problems. Topics can include autonomous vehicles, renewable energy systems, or biomedical devices. Develop engineering problem-solving and design thinking skills.",https://pioneeracademics.com/subjects/,Pioneer Academics,Research,"Engineering, Robotics, Mechanical Engineering, Electrical Engineering, Design",9-12,Paid,Online,5 weeks,High,High,Rolling admissions,High,Scholarships-available,Optional,Program-Fee,$1000+,True,True,True,High,True,False,Required,International,None,False,Professional
Pioneer Academics - Data Science and Statistics,"Research in data science, statistical analysis, or machine learning applications. Work with data science professor on topics like predictive modeling, big data analytics, or statistical inference. Study data visualization, experimental design, or causal inference. Research may involve analyzing real-world datasets or developing new statistical methods. Topics can include sports analytics, healthcare data, or social network analysis. Learn R, Python, and statistical software.",https://pioneeracademics.com/subjects/,Pioneer Academics,Research,"Data Science, Statistics, Analytics, Machine Learning, Quantitative Analysis",9-12,Paid,Online,5 weeks,High,High,Rolling admissions,High,Scholarships-available,Optional,Program-Fee,$1000+,True,True,True,High,True,False,Required,International,None,False,Professional
Pioneer Academics - Biomedical Science and Medicine,"Research in biomedical sciences exploring disease mechanisms, treatments, or medical technology. Work with medical school professor on topics like cancer biology, immunology, or drug development. Study pathophysiology, clinical research, or public health. Research may involve literature analysis, data mining, or theoretical modeling. Topics can include personalized medicine, vaccine development, or regenerative medicine. Explore career paths in medicine and biomedical research.",https://pioneeracademics.com/subjects/,Pioneer Academics,Research,"Biomedical Science, Medicine, Immunology, Pathology, Clinical Research",9-12,Paid,Online,5 weeks,High,High,Rolling admissions,High,Scholarships-available,Optional,Program-Fee,$1000+,True,True,True,High,True,False,Required,International,None,False,Professional
Pioneer Academics - Economics and Game Theory,"Research in economics, game theory, or behavioral economics. Work with economics professor on topics like market dynamics, strategic decision-making, or economic modeling. Study microeconomics, macroeconomics, or econometrics. Research may involve mathematical modeling, data analysis, or theoretical exploration. Topics can include auction theory, mechanism design, financial markets, or development economics. Develop quantitative economic analysis skills.",https://pioneeracademics.com/subjects/,Pioneer Academics,Research,"Economics, Game Theory, Mathematics, Behavioral Economics, Quantitative Analysis",9-12,Paid,Online,5 weeks,High,High,Rolling admissions,High,Scholarships-available,Optional,Program-Fee,$1000+,True,True,True,High,True,False,Required,International,None,False,Professional
Pioneer Academics - Psychology and Human Behavior,"Research in psychology exploring cognition, behavior, or mental health. Work with psychology professor on topics like decision-making, social psychology, or clinical psychology. Study experimental design, psychological assessment, or therapeutic interventions. Research may involve literature review, survey design, or data analysis. Topics can include memory, perception, personality, or developmental psychology. Develop understanding of psychological research methods.",https://pioneeracademics.com/subjects/,Pioneer Academics,Research,"Psychology, Cognitive Science, Behavioral Science, Research Methods, Statistics",9-12,Paid,Online,5 weeks,High,High,Rolling admissions,High,Scholarships-available,Optional,Program-Fee,$1000+,True,True,True,High,True,False,Required,International,None,False,Professional
Pioneer Academics - Public Health and Epidemiology,"Research in public health addressing disease prevention, health policy, or epidemiology. Work with public health professor on topics like infectious diseases, health disparities, or healthcare systems. Study statistical analysis of health data, disease modeling, or intervention evaluation. Research may explore social determinants of health, vaccine efficacy, or health communication. Topics can include pandemic response, health equity, or global health challenges.",https://pioneeracademics.com/subjects/,Pioneer Academics,Research,"Public Health, Epidemiology, Biostatistics, Health Policy, Disease Prevention",9-12,Paid,Online,5 weeks,High,High,Rolling admissions,High,Scholarships-available,Optional,Program-Fee,$1000+,True,True,True,High,True,False,Required,International,None,False,Professional
Pioneer Academics - Applied Mathematics and Optimization,"Research in applied mathematics focusing on optimization, operations research, or mathematical modeling. Work with professor on topics like linear programming, network flows, or algorithm optimization. Study applications of mathematics to real-world problems in logistics, finance, or engineering. Research may involve developing models, proving optimality, or computational implementations. Topics can include combinatorial optimization, stochastic processes, or numerical methods.",https://pioneeracademics.com/subjects/,Pioneer Academics,Research,"Applied Mathematics, Optimization, Operations Research, Mathematical Modeling, Algorithms",9-12,Paid,Online,5 weeks,High,High,Rolling admissions,High,Scholarships-available,Optional,Program-Fee,$1000+,True,True,True,High,True,False,Required,International,None,False,Professional
Pioneer Academics - Political Science and International Relations,"Research in political science exploring governance, policy, or international relations. Work with political science professor on topics like voting behavior, conflict resolution, or political institutions. Study quantitative political analysis, comparative politics, or international security. Research may involve data analysis, case studies, or theoretical modeling. Topics can include democratization, human rights, diplomacy, or political economy.",https://pioneeracademics.com/subjects/,Pioneer Academics,Research,"Political Science, International Relations, Data Analysis, Research Methods, Policy",9-12,Paid,Online,5 weeks,High,High,Rolling admissions,High,Scholarships-available,Optional,Program-Fee,$1000+,True,True,True,High,True,False,Required,International,None,False,Professional
Pioneer Academics - Philosophy and Logic,"Research in philosophy exploring ethics, metaphysics, epistemology, or logic. Work with philosophy professor on topics like moral philosophy, philosophy of mind, or formal logic. Study argumentation, critical reasoning, and philosophical methodology. Research may involve developing philosophical arguments, analyzing texts, or applying logic. Topics can include consciousness, free will, justice, or philosophy of science. Develop rigorous analytical thinking skills.",https://pioneeracademics.com/subjects/,Pioneer Academics,Research,"Philosophy, Logic, Critical Thinking, Ethics, Analytical Reasoning",9-12,Paid,Online,5 weeks,High,High,Rolling admissions,High,Scholarships-available,Optional,Program-Fee,$1000+,True,True,True,High,True,False,Required,International,None,False,Professional
Pioneer Academics - Scholarship and Financial Aid Program,"Merit-based and need-based scholarships available for exceptional students. Partial scholarships reducing program cost for qualified applicants. Selection based on academic excellence, research potential, and financial need. Commitment to making research opportunities accessible to students from all backgrounds. Application process considers financial circumstances. Focus on identifying talented students regardless of ability to pay. Supporting diversity in undergraduate-level research education.",https://pioneeracademics.com/,Pioneer Academics,Research,"Financial Aid, Scholarships, Access, Diversity",9-12,Paid,Online,5 weeks,High,High,Rolling admissions,Medium,Scholarships-available,Required,Program-Fee,$1000+,True,True,True,High,True,False,Required,International,None,False,Professional
